{
  "artifact_type": "fault_report",
  "created_at": "2026-06-28T00:00:00Z",
  "faults": [
    {
      "apply_status": "PASS",
      "clear_status": "PASS",
      "ended_at": "2026-06-28T00:00:00Z",
      "expected_impact": {
        "description": "Sandbox-scoped fault lifecycle is recorded without host network mutation.",
        "kind": "node_stop"
      },
      "fault_id": "fault-primary-stop",
      "fault_type": "node_stop",
      "observed_impact": {
        "action": "process_restart",
        "config_file": "/tmp/valkey-scale-lab/P20_FAILOVER_LATENCY_CURVE_30_50_100-scale_30_sample_02-20260628/shard-0001-primary/valkey.conf",
        "nodehost_container_name": "vslab-p20-failover-latency-curve-30-50-100-scale-30-sample-02-20260628-nodehost-az-b",
        "status": "PASS",
        "stderr": "",
        "stdout": ""
      },
      "scope": "owned_container_or_process",
      "started_at": "2026-06-28T00:00:00Z",
      "target_logical_id": "shard-0001-primary"
    }
  ],
  "phase_id": "P20_FAILOVER_LATENCY_CURVE_30_50_100",
  "producer": {
    "name": "valkey-scale-lab",
    "version": "0.0.0"
  },
  "run_id": "P20_FAILOVER_LATENCY_CURVE_30_50_100-scale_30_sample_02-20260628",
  "safety_checks": {
    "fault_state_cleared": true,
    "global_firewall_mutated": false,
    "host_network_mutated": false,
    "sandbox_only": true
  },
  "schema_version": "v1",
  "status": "PASS"
}
