{
  "schema_version": "v1",
  "artifact_type": "fault_report",
  "phase_id": "P12_SCALE_LADDER_10_30",
  "run_id": "phase-P12_SCALE_LADDER_10_30-scale_30_fault_failover-primary-stop",
  "created_at": "2026-07-02T05:12:55.193151Z",
  "producer": {
    "name": "scripts/fault_failover_gate.py",
    "version": "v1"
  },
  "status": "PASS",
  "faults": [
    {
      "fault_id": "fault-primary-stop",
      "fault_type": "node_stop",
      "scope": "owned_container_or_process",
      "target_logical_id": "shard-0003-primary",
      "apply_status": "PASS",
      "clear_status": "PASS",
      "fault_apply_latency_ms": 116.037,
      "fault_clear_latency_ms": 163.476,
      "after_clear_nodes_observed": 30,
      "after_clear_cluster_state": "ok"
    }
  ],
  "safety_checks": {
    "host_network_mutated": false,
    "global_firewall_mutated": false,
    "sandbox_only": true
  }
}
