{
  "artifact_type": "fault_report",
  "created_at": "2026-06-28T00:00:00Z",
  "faults": [
    {
      "apply_status": "PASS",
      "clear_status": "PASS",
      "ended_at": "2026-06-28T00:00:00Z",
      "expected_impact": {
        "description": "Sandbox-scoped fault lifecycle is recorded without host network mutation.",
        "kind": "node_stop"
      },
      "fault_id": "p33-az_stop-shard-0024-replica-00",
      "fault_parameters": {},
      "fault_type": "node_stop",
      "implementation_path": "owned_runtime_control",
      "observed_impact": {
        "action": "process_restart",
        "config_file": "/tmp/valkey-scale-lab/P33_FAULT_FAILOVER_MATRIX_50_REAL-strict_fault_matrix_50-20260628/shard-0024-replica-00/valkey.conf",
        "nodehost_container_name": "vslab-p33-fault-failover-matrix-50-real-strict-fault-matrix-50-20260628-nodehost-az-b",
        "status": "PASS",
        "stderr": "",
        "stdout": ""
      },
      "scope": "owned_runtime_control",
      "started_at": "2026-06-28T00:00:00Z",
      "target_logical_id": "shard-0024-replica-00"
    }
  ],
  "phase_id": "P33_FAULT_FAILOVER_MATRIX_50_REAL",
  "producer": {
    "name": "valkey-scale-lab",
    "version": "0.0.0"
  },
  "run_id": "P33_FAULT_FAILOVER_MATRIX_50_REAL-strict_fault_matrix_50-20260628",
  "safety_checks": {
    "fault_state_cleared": true,
    "global_firewall_mutated": false,
    "host_network_mutated": false,
    "sandbox_only": true
  },
  "schema_version": "v1",
  "status": "PASS"
}
